[
  {
    "test_sequence": 1,
    "step": 1,
    "command": "echo 'hello'",
    "exit_code": 0,
    "output": "hello",
    "timestamp": "2026-02-02T10:00:00.000000+00:00"
  },
  {
    "test_sequence": 1,
    "step": 2,
    "command": "true",
    "exit_code": 0,
    "output": "",
    "timestamp": "2026-02-02T10:00:01.000000+00:00"
  },
  {
    "test_sequence": 2,
    "step": 1,
    "command": "echo 'world'",
    "exit_code": 0,
    "output": "world",
    "timestamp": "2026-02-02T10:00:02.000000+00:00"
  }
]
