[
  {
    "test_sequence": 1,
    "step": 1,
    "command": "echo \"Sequence 1 - Step 1 executed\"",
    "exit_code": 0,
    "output": "Sequence 1 - Step 1 executed",
    "timestamp": "2024-03-15T15:10:00.100000+00:00"
  },
  {
    "test_sequence": 1,
    "step": 2,
    "command": "echo \"Sequence 1 - Step 2 executed\"",
    "exit_code": 0,
    "output": "Sequence 1 - Step 2 executed",
    "timestamp": "2024-03-15T15:10:00.200000+00:00"
  },
  {
    "test_sequence": 2,
    "step": 1,
    "command": "echo \"Sequence 2 - Step 1 executed\"",
    "exit_code": 0,
    "output": "Sequence 2 - Step 1 executed",
    "timestamp": "2024-03-15T15:10:00.300000+00:00"
  },
  {
    "test_sequence": 2,
    "step": 2,
    "command": "echo \"Sequence 2 - Step 2 executed\"",
    "exit_code": 0,
    "output": "Sequence 2 - Step 2 executed",
    "timestamp": "2024-03-15T15:10:00.400000+00:00"
  },
  {
    "test_sequence": 3,
    "step": 1,
    "command": "echo \"Sequence 3 - Step 1 executed\"",
    "exit_code": 0,
    "output": "Sequence 3 - Step 1 executed",
    "timestamp": "2024-03-15T15:10:00.500000+00:00"
  },
  {
    "test_sequence": 0,
    "step": 0,
    "command": "scripts/hook_script_end_error.sh",
    "exit_code": 1,
    "output": "ERROR: script_end hook failed at final script termination",
    "timestamp": "2024-03-15T15:10:00.600000+00:00",
    "hook_type": "script_end",
    "hook_script": "scripts/hook_script_end_error.sh"
  }
]
