[
  {
    "test_sequence": 1,
    "step": 1,
    "command": "echo \"Sequence 1 - Step 1\"",
    "exit_code": 0,
    "output": "Sequence 1 - Step 1",
    "timestamp": "2026-02-28T10:00:00.123456+00:00"
  },
  {
    "test_sequence": 1,
    "step": 2,
    "command": "echo \"Sequence 1 - Step 2\"",
    "exit_code": 0,
    "output": "Sequence 1 - Step 2",
    "timestamp": "2026-02-28T10:00:00.456789+00:00"
  },
  {
    "test_sequence": 2,
    "step": 1,
    "command": "echo \"Sequence 2 - Step 1\"",
    "exit_code": 0,
    "output": "Sequence 2 - Step 1",
    "timestamp": "2026-02-28T10:00:00.789012+00:00"
  }
]
